<?xml version="1.0" encoding="UTF-8"?>
<!ELEMENT movies (movie+)>
<!ELEMENT movie (code,title,release-date?,theater-name+,city*)>
<!ELEMENT code (#PCDATA)>
<!ELEMENT title (#PCDATA)>
<!ELEMENT release-date(day,month,year)>
<!ELEMENT day(#PCDATA)>
<!ELEMENT month(#PCDATA)>
<!ELEMENT year(#PCDATA)>
<!ELEMENT threater-name (#PCDATA)>
<!ELEMENT city(#PCDATA)>